{
  "schema_version": "0.3",
  "case_id": "C03_VISIBLE_EXCHANGE",
  "decoder_id": "deepseek-v4-flash__PROSE",
  "purpose": "analysis of the research artifact",
  "claim": "A human shares a research artifact with an AI service under a data transfer that is declared, explicitly consented to, limited to analysis, and reversible through deletion.",
  "operation_path": [],
  "invariants": [
    "The data transfer is declared.",
    "The data transfer is explicitly consented to.",
    "The data transfer is limited to analysis.",
    "The data transfer is reversible through deletion."
  ],
  "unknowns": [
    "The content or nature of the research artifact is unspecified.",
    "The identities of the human and the AI service are unspecified.",
    "The deletion mechanism and timing are unspecified.",
    "Whether deletion will actually occur is unspecified."
  ],
  "authority": [],
  "participants": [
    "a human",
    "an AI service"
  ],
  "affected_parties": [],
  "evidence": [],
  "provenance": [
    "provided source statement"
  ],
  "dissent": [],
  "value_ledger": [
    {
      "from": "human",
      "to": "AI service",
      "resource": "research artifact",
      "basis": "explicit consent",
      "restriction": "limited to analysis",
      "reversibility": "deletion"
    }
  ],
  "consequences": [],
  "consequence_horizon": "unspecified",
  "recovery": [
    "deletion of the research artifact"
  ],
  "confidence": "high",
  "notes": "The statement describes a declared, analysis-limited, explicitly consented, deletion-reversible transfer. No authority, evidence, dissent, affected parties, or post-transfer consequences are stated beyond the transfer terms and the availability of deletion as a reversibility mechanism. operation_path is empty because no ordered operation labels were provided."
}